{"type":"config","name":"Repo-wide speed + efficiency: build and research pipeline","metricName":"build_ms","metricUnit":"ms","bestDirection":"lower"}
{"run":1,"commit":"c89c721","metric":9897,"metrics":{},"status":"keep","description":"Baseline session setup: added auto/program.md, auto/autoresearch.sh, and autoresearch.checks.sh; benchmarking pnpm build as primary metric.","timestamp":1773954119374,"segment":0,"confidence":null}
{"run":2,"commit":"84d42a6","metric":6030,"metrics":{},"status":"keep","description":"Memoized getPieces() and getPieceFragments() in lib/pieces.ts so static generation, metadata, and OG routes reuse parsed content instead of rereading all markdown files.","timestamp":1773954167600,"segment":0,"confidence":null}
{"type":"config","name":"Repo-wide speed + efficiency: cold pnpm build","metricName":"build_ms","metricUnit":"ms","bestDirection":"lower"}
{"run":3,"commit":"7e9e6a7","metric":8577,"metrics":{},"status":"keep","description":"Reset session to cold-build benchmarking by clearing .next in auto/autoresearch.sh and updated auto/program.md; established corrected baseline with memoized content loading still in place.","timestamp":1773954217013,"segment":1,"confidence":null}
{"run":4,"commit":"b7312fc","metric":8352,"metrics":{},"status":"keep","description":"Enabled Next experimental optimizePackageImports for lucide-react to reduce module processing during cold production builds.","timestamp":1773954280424,"segment":1,"confidence":null}
{"run":5,"commit":"b7312fc","metric":9948,"metrics":{},"status":"discard","description":"Tried removing the redundant Google Fonts CSS @import from app/globals.css, but cold build time regressed materially under the benchmark.","timestamp":1773954304936,"segment":1,"confidence":1}
{"run":6,"commit":"b7312fc","metric":9355,"metrics":{},"status":"discard","description":"Tried excluding __tests__ directories from tsconfig.json so Next build would scan less TypeScript, but cold build time regressed under the benchmark.","timestamp":1773954348176,"segment":1,"confidence":0.44865403788634095}
{"run":7,"commit":"b7312fc","metric":9294,"metrics":{},"status":"discard","description":"Validation run: reverted lucide-react optimizePackageImports to test whether the prior win was noise; cold build regressed, so keeping the lucide import optimization.","timestamp":1773954382447,"segment":1,"confidence":0.3440366972477064}
{"run":8,"commit":"b7312fc","metric":9021,"metrics":{},"status":"discard","description":"Tried targeted piece helpers (getPieceSlugs/getPieceBySlug) so static params and OG metadata could avoid full collection loads, but cold build was still slower than the cached all-pieces approach.","timestamp":1773954456108,"segment":1,"confidence":0.5784061696658098}
{"run":9,"commit":"b7312fc","metric":8659,"metrics":{},"status":"discard","description":"Validation run: removed lib/pieces.ts memoization to measure its cold-build impact directly; build got slightly slower, so keep the cached content-loader path.","timestamp":1773954512531,"segment":1,"confidence":0.6215469613259669}
{"run":10,"commit":"b7312fc","metric":12844,"metrics":{},"status":"discard","description":"Resumed session and tried a lighter PieceSummary path for static params/metadata/OG routes, but duplicating summary loads alongside full getPieces() made cold builds much worse.","timestamp":1773954673937,"segment":1,"confidence":0.4170528266913809}
{"run":11,"commit":"b7312fc","metric":8483,"metrics":{},"status":"discard","description":"Control re-run on the current kept code to measure cold-build noise; no code changes, result used only to improve confidence calibration.","timestamp":1773954707309,"segment":1,"confidence":0.5067567567567568}
{"run":12,"commit":"8eb2c82","metric":8310,"metrics":{},"status":"keep","description":"Removed four unused Geist pixel font variants from app/layout.tsx and app/globals.css, keeping only the mono pixel font that is actually referenced.","timestamp":1773954780563,"segment":1,"confidence":0.5668789808917197}
{"run":13,"commit":"8eb2c82","metric":8616,"metrics":{},"status":"discard","description":"Confirmation run on the unchanged font-cleanup HEAD; result bounced back above baseline, so the improvement is likely small and noisy even though the cleanup itself is harmless.","timestamp":1773954803701,"segment":1,"confidence":0.7650429799426934}
{"run":14,"commit":"8eb2c82","metric":8570,"metrics":{},"status":"discard","description":"Expanded optimizePackageImports to more client libraries, but the result was effectively baseline-level and clearly worse than the current best kept build.","timestamp":1773954835540,"segment":1,"confidence":0.8711256117455138}
{"run":15,"commit":"8eb2c82","metric":9141,"metrics":{},"status":"discard","description":"Tried isolating a cheap getPieceSlugs() helper just for generateStaticParams(), but even that split path regressed compared with the existing cached getPieces() approach.","timestamp":1773954886553,"segment":1,"confidence":0.7650429799426934}
{"run":16,"commit":"8eb2c82","metric":9156,"metrics":{},"status":"discard","description":"Tried removing TypeScript incremental mode from tsconfig.json for cold builds, but the build got slower.","timestamp":1773954927957,"segment":1,"confidence":0.7934621099554234}
{"run":17,"commit":"8eb2c82","metric":8460,"metrics":{},"status":"checks_failed","description":"Tried next/cache unstable_cache for getPieces(); benchmark looked promising, but correctness checks failed because unstable_cache requires Next incremental cache context and breaks Vitest/script usage.","timestamp":1773954988863,"segment":1,"confidence":0.7650429799426934}
{"run":18,"commit":"8eb2c82","metric":8394,"metrics":{},"status":"discard","description":"Made unstable_cache safe for tests/scripts with a direct-load fallback; checks passed and build improved over baseline, but it was still worse than the current best kept result.","timestamp":1773955029866,"segment":1,"confidence":0.8711256117455138}
{"run":19,"commit":"8eb2c82","metric":8681,"metrics":{},"status":"discard","description":"Tried deferring @huggingface/inference in lib/retrieval.ts with a dynamic import to shrink build-time server module work, but cold build time regressed.","timestamp":1773955076025,"segment":1,"confidence":0.8697068403908795}
{"run":20,"commit":"8eb2c82","metric":9602,"metrics":{},"status":"discard","description":"Tried lazy-loading AI route dependencies inside app/api/chat/route.ts so build would process less server code up front, but cold build time regressed sharply.","timestamp":1773955115894,"segment":1,"confidence":0.7982062780269058}
{"run":21,"commit":"8eb2c82","metric":11661,"metrics":{},"status":"discard","description":"Tried synchronous readFileSync in lib/pieces.ts to cut async overhead, but it made cold builds much slower.","timestamp":1773955186978,"segment":1,"confidence":0.7852941176470588}
{"run":22,"commit":"8eb2c82","metric":0,"metrics":{},"status":"crash","description":"Tried moving large tooltip dictionaries to JSON, but the build crashed during prerender because the JSON wrapper did not match the runtime import shape.","timestamp":1773955272491,"segment":1,"confidence":0.7852941176470588}
{"run":23,"commit":"42e7867","metric":8092,"metrics":{},"status":"keep","description":"Removed next/font/google usage from app/layout.tsx and relied on the existing Google Fonts CSS import in app/globals.css, avoiding duplicate font-loading/build work.","timestamp":1773955314578,"segment":1,"confidence":1.3642756680731365}
{"run":24,"commit":"42e7867","metric":8110,"metrics":{},"status":"discard","description":"Confirmation re-run on the unchanged font-simplified HEAD; result stayed close to the previous win, increasing confidence without introducing a new code change.","timestamp":1773955334552,"segment":1,"confidence":1.339779005524862}
{"type":"config","name":"Research pipeline + build speed: deterministic daily research benchmark","metricName":"research_ms","metricUnit":"ms","bestDirection":"lower"}
{"run":38,"commit":"170b15e","metric":1755,"metrics":{},"status":"keep","description":"New session baseline: deterministic local research-pipeline benchmark with a mock autoresearch repo/command, plus monitored embedding prep and cold build metrics.","timestamp":1773956548020,"segment":2,"confidence":null}
{"run":39,"commit":"0cf8f0e","metric":683,"metrics":{},"status":"keep","description":"Cached autoresearch dependency setup in scripts/research/autoresearch.ts so a single daily run no longer refetches/recheckouts the dependency once per piece.","timestamp":1773956585071,"segment":2,"confidence":null}
{"run":40,"commit":"0cf8f0e","metric":684,"metrics":{},"status":"discard","description":"Control re-run on the unchanged repo-setup cache HEAD; research benchmark stayed essentially identical, increasing confidence in the large win.","timestamp":1773956610406,"segment":2,"confidence":1072}
{"run":41,"commit":"d8a325f","metric":620,"metrics":{},"status":"keep","description":"Made research output URL collection iterative and parallelized file reads within each directory in scripts/research/autoresearch.ts.","timestamp":1773956668512,"segment":2,"confidence":35.46875}
{"run":42,"commit":"d8a325f","metric":700,"metrics":{},"status":"discard","description":"Suppressed git setup command stdio during autoresearch dependency sync, but the research benchmark regressed versus the current best.","timestamp":1773956744712,"segment":2,"confidence":70.9375}
{"run":43,"commit":"d8a325f","metric":689,"metrics":{},"status":"discard","description":"Replaced query construction with a bounded imperative loop in gatherAutoResearchResults(), but it remained slower than the current best.","timestamp":1773956773895,"segment":2,"confidence":133.52941176470588}
{"run":44,"commit":"d8a325f","metric":639,"metrics":{},"status":"discard","description":"Cached the output date label once per process in scripts/research/autoresearch.ts; it helped a little but still did not beat the current best.","timestamp":1773956808663,"segment":2,"confidence":70.9375}
{"run":45,"commit":"d8a325f","metric":700,"metrics":{},"status":"discard","description":"Replaced URL parsing in buildSearchResults() with simple hostname regex extraction, but the benchmark regressed to the slower range.","timestamp":1773956840354,"segment":2,"confidence":84.07407407407408}
{"run":46,"commit":"d8a325f","metric":660,"metrics":{},"status":"discard","description":"Skipped unconditional outputDir mkdir for custom command runs in gatherAutoResearchResults(), but the benchmark still did not beat the current best.","timestamp":1773956884583,"segment":2,"confidence":70.9375}
{"run":47,"commit":"d8a325f","metric":636,"metrics":{},"status":"discard","description":"Switched parseDate() to Date.parse() on the shared piece-loading path; it helped a little but still did not beat the current best research benchmark.","timestamp":1773956937107,"segment":2,"confidence":56.75}
{"run":48,"commit":"d8a325f","metric":670,"metrics":{},"status":"discard","description":"Added an includes() fast-path before update-marker regex scanning in lib/pieces.ts, but it still underperformed the current best research run.","timestamp":1773956966274,"segment":2,"confidence":66.76470588235294}
{"run":49,"commit":"d8a325f","metric":694,"metrics":{},"status":"discard","description":"Replaced parseFrontmatter() with a direct line scanner to reduce allocations on piece loading, but it regressed the research benchmark.","timestamp":1773956999182,"segment":2,"confidence":68.78787878787878}
{"run":50,"commit":"d8a325f","metric":654,"metrics":{},"status":"discard","description":"Control re-run on the unchanged current best research HEAD; result stayed in the same range and confirms the provider/setup wins remain stable.","timestamp":1773957021605,"segment":2,"confidence":66.76470588235294}
{"type":"config","name":"Round 3: research core + embedding determinism","metricName":"research_core_ms","metricUnit":"ms","bestDirection":"lower"}
{"run":51,"commit":"331b1d3","metric":598,"metrics":{},"status":"keep","description":"Round 3 baseline: deterministic research-core and embedding benchmarks with git/network excluded from the timed section, plus RSS monitoring.","timestamp":1773957582881,"segment":3,"confidence":null}
{"run":52,"commit":"6096f1e","metric":586,"metrics":{},"status":"keep","description":"Cached stable env-derived autoresearch configuration on first use in scripts/research/autoresearch.ts, trimming repeated per-piece env/default resolution.","timestamp":1773957641280,"segment":3,"confidence":null}
{"run":53,"commit":"6096f1e","metric":595,"metrics":{},"status":"discard","description":"Cached safe slug generation and the dated autoresearch output root, but the research-core benchmark was slightly worse than the current best.","timestamp":1773957714654,"segment":3,"confidence":4}
{"run":54,"commit":"6096f1e","metric":598,"metrics":{},"status":"discard","description":"Switched autoresearch command execution from manual spawn wiring to promisified execFile, but it regressed back to baseline-level research-core timing.","timestamp":1773957791545,"segment":3,"confidence":8}
